{
  "decision_id": "dec-001",
  "action_id": "act-001",
  "manifest_hash": "8f1e0c1e9a2b3c4d5e6f7081920a1b2c3d4e5f60718293a4b5c6d7e8f9001122",
  "policy_version": "policy-2026.07.0",
  "result": "allowed",
  "matched_rules": ["allow.file_write.in_workspace", "under.risk_ceiling"],
  "explanation": "Write target is inside the granted path prefix and under the risk ceiling.",
  "required_review": null,
  "required_simulation": null,
  "created_at": "2026-07-03T18:01:00Z"
}
